{
  "id": "ageing-navigator-family",
  "version": "2026-09-1",
  "title": "Free Family Ageing Questionnaire",
  "intro": [
    "Tell us what's happening, and we'll help you work out what to do next.",
    "This questionnaire prepares your free personalised Family Ageing Action Plan. Depending on your situation it takes around 10 to 15 minutes, and you will only be shown questions that are relevant to you.",
    "You don't need to know every answer. “Not sure” is useful information too.",
    "Please don't include account numbers, passwords, detailed medical records or other highly confidential information."
  ],
  "notice": "Ageing Navigator provides independent ageing-related information and navigation. It does not provide medical diagnoses, legal or financial advice, or formal government needs assessments. If someone is in immediate danger or needs urgent medical attention, contact the appropriate emergency service.",
  "sections": [
    {
      "id": "contact",
      "title": "Who this plan is for",
      "intro": "We only need enough to prepare and address your plan. Please do not include account numbers, passwords or detailed medical records.",
      "questions": [
        {
          "id": "c_your_name",
          "type": "short",
          "label": "Your name"
        },
        {
          "id": "c_your_email",
          "type": "short",
          "label": "Your email address",
          "help": "Where we send the finished Action Plan.",
          "format": "email"
        },
        {
          "id": "c_person_first",
          "type": "short",
          "label": "The older person's first name"
        },
        {
          "id": "c_person_last",
          "type": "short",
          "label": "Their last name"
        },
        {
          "id": "c_person_preferred",
          "type": "short",
          "label": "What do they like to be called?",
          "optional": true
        }
      ]
    },
    {
      "id": "s1",
      "title": "About your situation",
      "questions": [
        {
          "id": "q1",
          "type": "single",
          "label": "How are you completing this questionnaire?",
          "options": [
            {
              "value": "self",
              "label": "I am completing it for myself"
            },
            {
              "value": "family_member",
              "label": "I am completing it about a parent or family member"
            },
            {
              "value": "partner",
              "label": "I am completing it about my husband, wife or partner"
            },
            {
              "value": "friend",
              "label": "I am completing it about a friend"
            },
            {
              "value": "helping_person",
              "label": "I am helping the older person complete it"
            },
            {
              "value": "helping_family",
              "label": "I am helping the family complete it"
            },
            {
              "value": "other",
              "label": "Other"
            }
          ]
        },
        {
          "id": "q2",
          "type": "single",
          "label": "What is your relationship to the older person?",
          "options": [
            {
              "value": "son_daughter",
              "label": "Son or daughter"
            },
            {
              "value": "in_law",
              "label": "Son-in-law or daughter-in-law"
            },
            {
              "value": "partner",
              "label": "Husband, wife or partner"
            },
            {
              "value": "sibling",
              "label": "Sibling"
            },
            {
              "value": "other_family",
              "label": "Other family member"
            },
            {
              "value": "friend",
              "label": "Friend"
            },
            {
              "value": "professional",
              "label": "Professional or support person"
            },
            {
              "value": "other",
              "label": "Other"
            }
          ],
          "when": {
            "not": {
              "field": "q1",
              "op": "eq",
              "value": "self"
            }
          }
        },
        {
          "id": "q3",
          "type": "single",
          "label": "How involved is the older person in thinking about these decisions?",
          "options": [
            {
              "value": "active",
              "label": "They are actively involved"
            },
            {
              "value": "some",
              "label": "They are involved to some extent"
            },
            {
              "value": "prefers_family",
              "label": "They prefer the family to organise things"
            },
            {
              "value": "reluctant",
              "label": "They are reluctant to discuss or accept help"
            },
            {
              "value": "difficulty",
              "label": "They may have difficulty understanding or participating in some decisions"
            },
            {
              "value": "unable",
              "label": "They are currently unable to participate"
            },
            {
              "value": "unsure",
              "label": "Not sure"
            }
          ]
        },
        {
          "id": "q4",
          "type": "single",
          "label": "Approximately how old are they?",
          "options": [
            {
              "value": "under_65",
              "label": "Under 65"
            },
            {
              "value": "65_69",
              "label": "65 to 69"
            },
            {
              "value": "70_74",
              "label": "70 to 74"
            },
            {
              "value": "75_79",
              "label": "75 to 79"
            },
            {
              "value": "80_84",
              "label": "80 to 84"
            },
            {
              "value": "85_89",
              "label": "85 to 89"
            },
            {
              "value": "90_plus",
              "label": "90 or older"
            },
            {
              "value": "unsure",
              "label": "Not sure"
            }
          ]
        },
        {
          "id": "q5_town",
          "type": "short",
          "label": "Which town or city do they live in?",
          "help": "Town or city and region only."
        },
        {
          "id": "q5_region",
          "type": "short",
          "label": "Which region?",
          "help": "For example Canterbury, Wellington or Nelson."
        },
        {
          "id": "q6",
          "type": "single",
          "label": "What is their current living situation?",
          "options": [
            {
              "value": "alone",
              "label": "Living alone in their own home"
            },
            {
              "value": "with_partner",
              "label": "Living with a spouse or partner"
            },
            {
              "value": "with_family",
              "label": "Living with family"
            },
            {
              "value": "village_independent",
              "label": "Retirement village, independent living"
            },
            {
              "value": "village_serviced",
              "label": "Retirement village, serviced apartment or care suite"
            },
            {
              "value": "residential_care",
              "label": "Residential care"
            },
            {
              "value": "in_hospital",
              "label": "Currently in hospital"
            },
            {
              "value": "temporary",
              "label": "Temporarily staying with family or friends"
            },
            {
              "value": "other",
              "label": "Other"
            },
            {
              "value": "unsure",
              "label": "Not sure"
            }
          ]
        },
        {
          "id": "q6_owns",
          "type": "single",
          "label": "Do they own the home they live in?",
          "options": [
            {
              "value": "yes",
              "label": "Yes"
            },
            {
              "value": "no",
              "label": "No"
            },
            {
              "value": "unsure",
              "label": "Not sure"
            }
          ]
        },
        {
          "id": "q7",
          "type": "single",
          "label": "Which best describes why you are completing this questionnaire now?",
          "options": [
            {
              "value": "planning_ahead",
              "label": "Things are going reasonably well, we want to plan ahead"
            },
            {
              "value": "noticed_changes",
              "label": "We've noticed a few changes and want to know what we should think about"
            },
            {
              "value": "needs_more_help",
              "label": "They are starting to need more help"
            },
            {
              "value": "increasingly_concerned",
              "label": "We're becoming increasingly concerned"
            },
            {
              "value": "something_changed",
              "label": "Something significant has recently changed"
            },
            {
              "value": "major_event",
              "label": "There has been a fall, hospital admission or other major event"
            },
            {
              "value": "important_decision",
              "label": "We need to make an important decision"
            },
            {
              "value": "struggling",
              "label": "We're struggling to manage the situation"
            },
            {
              "value": "not_sure",
              "label": "I'm not really sure what they need"
            }
          ],
          "help": "Choose the closest answer."
        }
      ]
    },
    {
      "id": "s2",